### ISSUE TITLE
Websocket error: 1002 - Protocol error

### ISSUE THREAD

**Issue by fbuetler** [eclipse-vertx/vertx-http-proxy#125]
### Version

* 4.5.15
* 5.0.0

### Context

We observed an issue with an application served through the `vertx-http-proxy` while using websockets. It seems, websocket requests are upgraded correctly, but are then not able to handle any bidrectional data that is sent.

### Do you have a reproducer?

The issue happens with both, the latest 4.x version and the freshly releases 5.0 version. The reproducers are generated with the `vertx-starter`:

* 4.5.15: [starter4.zip](https://github.com/user-attachments/files/20612021/starter4.zip)
* 5.0.0: [starter5.zip](https://github.com/user-attachments/files/20612023/starter5.zip)

### Steps to reproduce

1. Run proxy on port `8888`:`mvn package exec:java`
2. Run websocket server on `8080`: `docker run -p 8080:8080 jmalloc/echo-server`
3. Open websocket with [wscat](https://github.com/websockets/wscat): `wscat --connect ws://localhost:8888/.ws`
4. See a successful connection, then send something
5. Observe error: [1002 - protocol error](https://developer.mozilla.org/en-US/docs/Web/API/CloseEvent/code)

```bash
➜ wscat --connect ws://localhost:8888/.ws
Connected (press CTRL+C to quit)
< Request served by d2bf9654e1a2
> a
Disconnected (code: 1002, reason: "unexpected reserved bits 0x40")
```

This is also reproducible with Chrome: 
`CloseEvent {isTrusted: true, wasClean: true, code: 1002, reason: 'unexpected reserved bits 0x40', type: 'close', …}`

In both scenarios (wscat/chrome), the error does not happen, if the websocket server is accessed directly on `localhost:8080`.

```bash
 wscat --connect ws://localhost:8080/.ws
Connected (press CTRL+C to quit)
< Request served by a2cd0ebe7c02
> d
< d
```

### Extra

* Java 21.0.6

**Comment by fbuetler** [comment]
With wireshark:

client -> proxy
```
Frame 154: 85 bytes on wire (680 bits), 85 bytes captured (680 bits) on interface lo0, id 0
Null/Loopback
Internet Protocol Version 6, Src: ::1, Dst: ::1
Transmission Control Protocol, Src Port: 59053, Dst Port: 8888, Seq: 227, Ack: 208, Len: 9
WebSocket
    1... .... = Fin: True
    .100 .... = Reserved: 0x4
    .1.. .... = Per-Message Compressed: True
    .... 0001 = Opcode: Text (1)
    1... .... = Mask: True
    .000 0011 = Payload length: 3
    Masking-Key: b28af725
    Masked payload
    Payload
        Text: a
Line-based text data (1 lines)
```

proxy -> server
```
Frame 156: 65 bytes on wire (520 bits), 65 bytes captured (520 bits) on interface lo0, id 0
Null/Loopback
Internet Protocol Version 4, Src: 127.0.0.1, Dst: 127.0.0.1
Transmission Control Protocol, Src Port: 59054, Dst Port: 8080, Seq: 227, Ack: 162, Len: 9
WebSocket
    1... .... = Fin: True
    .100 .... = Reserved: 0x4
    .... 0001 = Opcode: Text (1)
    1... .... = Mask: True
    .000 0011 = Payload length: 3
    Masking-Key: b28af725
    Masked payload
    Payload
        Text: J\x04
Line-based text data (1 lines)
```

It appears, the proxy is not setting the `Per-Message Compressed` bit. This might make the server decode the payload differently: `J\x04` as opposed to `a`.

What follows is the server terminating the connection.

**Comment by tsegismont** [comment]
Made some progress on analysis.

The problem is that the proxy adds its WebSocket capabilities through the [`Sec-WebSocket-Extensions header` header](https://developer.mozilla.org/en-US/docs/Web/API/WebSockets_API#related_http_headers) even though the backend doesn't support them.

In this case, the client indicates it supports per-message deflate with `sec-websocket-extensions: permessage-deflate
`.
The backend does not reply with this header, indicating it doesn't support it.
The proxy replies to the client with `sec-websocket-extensions: permessage-deflate`, indicating it supports it.

Consequently, the client sends WS compressed messages, because the handshake is broken.

This happens because the proxy invokes `io.vertx.core.http.HttpServerRequest#toNetSocket` , which triggers the `io.netty.handler.codec.http.websocketx.extensions.WebSocketServerExtensionHandler#onHttpResponseWrite` callback.

In this method, Netty computes the WS capabilities of the proxy server, given the `HttpServerOptions` used to create the Vert.x `HttpServer`.

**Comment by tsegismont** [comment]
For HTTP 1.1, this patch in Vert.x core solves the issue:

```patch
Index: vertx-core/src/main/java/io/vertx/core/http/impl/Http1xServerResponse.java
IDEA additional info:
Subsystem: com.intellij.openapi.diff.impl.patch.CharsetEP
<+>UTF-8
===================================================================
diff --git a/vertx-core/src/main/java/io/vertx/core/http/impl/Http1xServerResponse.java b/vertx-core/src/main/java/io/vertx/core/http/impl/Http1xServerResponse.java
--- a/vertx-core/src/main/java/io/vertx/core/http/impl/Http1xServerResponse.java	(revision 85455726e31d0140c1687ed5c899499026dd8075)
+++ b/vertx-core/src/main/java/io/vertx/core/http/impl/Http1xServerResponse.java	(date 1749563188279)
@@ -14,8 +14,10 @@
 import io.netty.buffer.ByteBuf;
 import io.netty.buffer.Unpooled;
 import io.netty.channel.ChannelFuture;
+import io.netty.channel.ChannelPipeline;
 import io.netty.handler.codec.http.*;
 import io.netty.handler.codec.http.HttpVersion;
+import io.netty.handler.codec.http.websocketx.extensions.WebSocketServerExtensionHandler;
 import io.vertx.codegen.annotations.Nullable;
 import io.vertx.core.Future;
 import io.vertx.core.Handler;
@@ -682,6 +684,11 @@
         if (!HttpUtils.isConnectOrUpgrade(requestMethod, requestHeaders)) {
           return context.failedFuture("HTTP method must be CONNECT or an HTTP upgrade to upgrade the connection to a TCP socket");
         }
+        ChannelPipeline pipeline = conn.channel().pipeline();
+        WebSocketServerExtensionHandler wsHandler = pipeline.get(WebSocketServerExtensionHandler.class);
+        if (wsHandler != null) {
+          pipeline.remove(wsHandler);
+        }
         status = requestMethod == HttpMethod.CONNECT ? HttpResponseStatus.OK : HttpResponseStatus.SWITCHING_PROTOCOLS;
         prepareHeaders(-1);
         PromiseInternal<Void> upgradePromise = context.promise();
```

I'll send a PR to Vert.x core when I can put together a test and fixes required (regardless of HTTP version).

**Comment by fbuetler** [comment]
Thanks a lot @tsegismont !
